{
  "manifestVersion": 1,
  "generatedAt": "2026-08-09T15:00:00Z",
  "root": "E:\\Claude",
  "measurement": {
    "totalGB": 43.76,
    "regenerableGB": 41.57,
    "contentGB": 2.25,
    "reparsePointsExcluded": true,
    "regenerationProven": true
  },
  "archive": {
    "destination": "C:\\Users\\Andri\\Archive\\straumvakt-preservation-2026-08-09",
    "checksumAlgorithm": "sha256",
    "verificationMethod": "extract-and-compare",
    "verified": true,
    "verifiedAt": "2026-08-09T15:00:00Z",
    "independentFailureDomain": true
  },
  "records": [
    {
      "id": "P-01",
      "path": "E:\\Claude\\Straumvakt-parked",
      "kind": "research",
      "expectedFileCount": 38,
      "verifiedFileCount": 38,
      "status": "verified",
      "verifiedAt": "2026-08-09T15:00:00Z",
      "recoveryPath": "archive",
      "recoveryNote": "Not a git worktree. No remote, no branch, no reflog. It exists in exactly one place.",
      "containsPersonalData": false,
      "thirdPartyLicensed": false,
      "deletable": false,
      "archiveVerified": true,
      "approval": "andri",
      "safeDeletePrerequisite": "verified archive extraction, plus a decision on whether it should be committed somewhere"
    },
    {
      "id": "P-02",
      "path": "E:\\Claude\\Straumvakt\\docs\\OCPP",
      "kind": "specification",
      "expectedFileCount": 128,
      "verifiedFileCount": 128,
      "status": "verified",
      "verifiedAt": "2026-08-09T15:00:00Z",
      "recoveryPath": "archive",
      "recoveryNote": "Untracked in a git repository. Re-download depends on the standards body still publishing these versions.",
      "containsPersonalData": false,
      "thirdPartyLicensed": true,
      "deletable": false,
      "archiveVerified": true,
      "approval": "andri",
      "safeDeletePrerequisite": "AD-14 decided: committed or archived. The current state, untracked and unbacked, is not one of the options."
    },
    {
      "id": "P-04",
      "path": "C:\\Users\\Andri\\Documents\\New project",
      "kind": "prompts",
      "expectedFileCount": null,
      "verifiedFileCount": 22887,
      "status": "present-unverified",
      "verifiedAt": null,
      "recoveryPath": "none",
      "recoveryNote": "A .git directory with zero commits is not a backup. This is the single largest unmitigated preservation risk in the project.",
      "vcs": {
        "hasGitDir": true,
        "commitCount": 0,
        "trackedFileCount": 0,
        "untrackedTopLevel": 160
      },
      "containsPersonalData": false,
      "thirdPartyLicensed": false,
      "deletable": false,
      "archiveVerified": false,
      "approval": "andri",
      "safeDeletePrerequisite": "nothing here is a deletion candidate; the tool caches are, but only after the documents are committed"
    },
    {
      "id": "P-14",
      "path": "E:\\Claude\\**\\node_modules",
      "kind": "build-output",
      "expectedFileCount": null,
      "verifiedFileCount": null,
      "status": "not-applicable",
      "verifiedAt": null,
      "recoveryPath": "reinstall",
      "recoveryNote": "Reinstall, IF the demonstration in P-20 held. Regenerable assumes lockfiles resolve and pinned versions are still published.",
      "containsPersonalData": false,
      "thirdPartyLicensed": false,
      "deletable": true,
      "archiveVerified": false,
      "approval": "andri",
      "safeDeletePrerequisite": "npm ci and flutter pub get demonstrated to succeed into a temporary copy, per ecosystem, not assumed from one"
    }
  ],
  "junctions": [
    {
      "junction": "E:\\Claude\\Straumvakt-n1\\node_modules",
      "target": "E:\\Claude\\Straumvakt\\node_modules",
      "crossWorktree": true,
      "unlinkCommand": "Delete the junction (see runbook)",
      "targetFileCountBefore": 41207,
      "targetFileCountAfter": 41207
    }
  ],
  "worktrees": [
    {
      "path": "E:\\Claude\\Straumvakt-n1",
      "branch": "dev/n1-org-landing",
      "tip": "52e3b32",
      "uniqueCommits": 0,
      "dirtyFiles": 0,
      "retirable": true,
      "branchPreserved": true,
      "owner": "release-ops"
    },
    {
      "path": "E:\\Claude\\Straumvakt-onboarding-web",
      "branch": "codex/onboarding-web-experience",
      "tip": "0f4dbc8",
      "uniqueCommits": 12,
      "dirtyFiles": 0,
      "retirable": false,
      "branchPreserved": true,
      "owner": "codex"
    }
  ],
  "notes": "P10 warning. Not a recursive delete, but not a recognised non-following form either. An operator would have to interpret it."
}
